{
  "schemaVersion": 3,
  "applicationId": "LayoutContract",
  "framework": "FireMonkey",
  "sourceLanguage": "en-US",
  "locale": {
    "languageCode": "es-ES",
    "nativeLanguageName": "Español",
    "textDirection": "ltr"
  },
  "entries": [
    {
      "key": "ContractForm.lblDateRange.Text",
      "sourceText": "Start and end time:",
      "translatedText": "Horarios de inicio y finalización:",
      "formName": "ContractForm",
      "componentName": "lblDateRange",
      "componentClassName": "TLabel",
      "propertyName": "Text",
      "sourceFileName": "{FIXTUREDIR}\\13_preserve_label_font.fmx",
      "sourceKind": "Form property",
      "contextKind": "interface text",
      "textOwnership": "designerAutomatic",
      "status": "machineTranslated"
    }
  ]
}
