{
  "schemaVersion": 3,
  "applicationId": "LayoutContract",
  "applicationVersion": "",
  "framework": "FireMonkey",
  "sourceLanguage": "en-US",
  "locale": {
    "languageCode": "xx-XX",
    "nativeLanguageName": "Contract",
    "textDirection": "ltr",
    "shortDateFormat": "dd/mm/yyyy",
    "longDateFormat": "dddd, d mmmm yyyy",
    "shortTimeFormat": "h:nn",
    "longTimeFormat": "h:nn:ss",
    "decimalSeparator": ",",
    "thousandSeparator": ".",
    "currencySymbol": "$"
  },
  "entries": [
    {
      "key": "ContractForm.lblRecipient.Text",
      "sourceText": "Recipient:",
      "translatedText": "Direccion de correo del destinatario:",
      "formName": "ContractForm",
      "componentName": "lblRecipient",
      "componentClassName": "TLabel",
      "propertyName": "Text",
      "sourceFileName": "{FIXTUREDIR}\\17_caption_above_field_takes_its_column.fmx",
      "sourceLine": 7,
      "sourceKind": "Form property",
      "sourceChecksum": "",
      "contextKind": "interface text",
      "textOwnership": "designerAutomatic",
      "status": "machineTranslated"
    }
  ]
}
