{
  "schemaVersion": 3,
  "applicationId": "LayoutContract",
  "applicationVersion": "",
  "framework": "VCL",
  "sourceLanguage": "en-US",
  "locale": {
    "languageCode": "he-IL",
    "nativeLanguageName": "Contract",
    "textDirection": "rtl",
    "shortDateFormat": "dd/mm/yyyy",
    "longDateFormat": "dddd, d mmmm yyyy",
    "shortTimeFormat": "h:nn",
    "longTimeFormat": "h:nn:ss",
    "decimalSeparator": ",",
    "thousandSeparator": ".",
    "currencySymbol": "$"
  },
  "entries": [
    {
      "key": "ContractForm.lblFirst.Caption",
      "sourceText": "The first paragraph of the note",
      "translatedText": "The first paragraph of the note",
      "formName": "ContractForm",
      "componentName": "lblFirst",
      "componentClassName": "TLabel",
      "propertyName": "Caption",
      "sourceFileName": "{FIXTUREDIR}\\\\vcl_35_stacked_paragraphs_share_a_reading_edge.dfm",
      "sourceLine": 18,
      "sourceKind": "Form property",
      "sourceChecksum": "",
      "contextKind": "interface text",
      "textOwnership": "designerAutomatic",
      "status": "machineTranslated"
    },
    {
      "key": "ContractForm.lblSecond.Caption",
      "sourceText": "The second paragraph",
      "translatedText": "The second paragraph",
      "formName": "ContractForm",
      "componentName": "lblSecond",
      "componentClassName": "TLabel",
      "propertyName": "Caption",
      "sourceFileName": "{FIXTUREDIR}\\\\vcl_35_stacked_paragraphs_share_a_reading_edge.dfm",
      "sourceLine": 28,
      "sourceKind": "Form property",
      "sourceChecksum": "",
      "contextKind": "interface text",
      "textOwnership": "designerAutomatic",
      "status": "machineTranslated"
    }
  ]
}
