{
  "schemaVersion": 3,
  "applicationId": "LayoutContract",
  "applicationVersion": "",
  "framework": "FireMonkey",
  "sourceLanguage": "en-US",
  "locale": {
    "languageCode": "xx-XX",
    "nativeLanguageName": "Contract",
    "textDirection": "ltr",
    "shortDateFormat": "dd/mm/yyyy",
    "longDateFormat": "dddd, d mmmm yyyy",
    "shortTimeFormat": "h:nn",
    "longTimeFormat": "h:nn:ss",
    "decimalSeparator": ",",
    "thousandSeparator": ".",
    "currencySymbol": "$"
  },
  "entries": [
    {
      "key": "ContractForm.lblUser.Text",
      "sourceText": "User Name:",
      "translatedText": "Benutzername des Kontos:",
      "formName": "ContractForm",
      "componentName": "lblUser",
      "componentClassName": "TLabel",
      "propertyName": "Text",
      "sourceFileName": "{FIXTUREDIR}\\04_left_caption_takes_left_margin.fmx",
      "sourceLine": 10,
      "sourceKind": "Form property",
      "sourceChecksum": "",
      "contextKind": "interface text",
      "textOwnership": "designerAutomatic",
      "status": "machineTranslated"
    }
  ]
}