{
  "schemaVersion": 3,
  "applicationId": "LayoutContract",
  "applicationVersion": "",
  "framework": "VCL",
  "sourceLanguage": "en-US",
  "locale": {
    "languageCode": "xx-XX",
    "nativeLanguageName": "Contract",
    "textDirection": "ltr",
    "shortDateFormat": "dd/mm/yyyy",
    "longDateFormat": "dddd, d mmmm yyyy",
    "shortTimeFormat": "h:nn",
    "longTimeFormat": "h:nn:ss",
    "decimalSeparator": ",",
    "thousandSeparator": ".",
    "currencySymbol": "$"
  },
  "entries": [
    {
      "key": "ContractForm.lblInherits.Caption",
      "sourceText": "Daily bell schedule",
      "translatedText": "Programacion diaria de campanas",
      "formName": "ContractForm",
      "componentName": "lblInherits",
      "componentClassName": "TLabel",
      "propertyName": "Caption",
      "sourceFileName": "{FIXTUREDIR}\\vcl_20_inherited_font_is_the_forms_font.dfm",
      "sourceLine": 12,
      "sourceKind": "Form property",
      "sourceChecksum": "",
      "contextKind": "interface text",
      "textOwnership": "designerAutomatic",
      "status": "machineTranslated"
    }
  ]
}