{
  "schemaVersion": 3,
  "applicationId": "LayoutContract",
  "applicationVersion": "",
  "framework": "FireMonkey",
  "sourceLanguage": "en-US",
  "locale": {
    "languageCode": "xx-XX",
    "nativeLanguageName": "Contract",
    "textDirection": "ltr",
    "shortDateFormat": "dd/mm/yyyy",
    "longDateFormat": "dddd, d mmmm yyyy",
    "shortTimeFormat": "h:nn",
    "longTimeFormat": "h:nn:ss",
    "decimalSeparator": ",",
    "thousandSeparator": ".",
    "currencySymbol": "$"
  },
  "entries": [
    {
      "key": "ContractForm.lblInstructions.Text",
      "sourceText": "Click the Select Random Directory button for any directory box, pick a directory and add the dates.",
      "translatedText": "Haz clic en el boton Seleccionar directorio aleatorio para cualquier cuadro de directorio, selecciona un directorio y anade las fechas para incluirlo en la rotacion. Las fechas deben estar en formato mes/dia.",
      "formName": "ContractForm",
      "componentName": "lblInstructions",
      "componentClassName": "TLabel",
      "propertyName": "Text",
      "sourceFileName": "{FIXTUREDIR}\\23_a_paragraph_stays_on_the_form.fmx",
      "sourceLine": 12,
      "sourceKind": "Form property",
      "sourceChecksum": "",
      "contextKind": "interface text",
      "textOwnership": "designerAutomatic",
      "status": "machineTranslated"
    }
  ]
}
