{
  "schemaVersion": 3,
  "applicationId": "LayoutContract",
  "applicationVersion": "",
  "framework": "FireMonkey",
  "sourceLanguage": "en-US",
  "locale": {
    "languageCode": "de-DE",
    "nativeLanguageName": "Contract",
    "textDirection": "ltr",
    "shortDateFormat": "dd/mm/yyyy",
    "longDateFormat": "dddd, d mmmm yyyy",
    "shortTimeFormat": "h:nn",
    "longTimeFormat": "h:nn:ss",
    "decimalSeparator": ",",
    "thousandSeparator": ".",
    "currencySymbol": "$"
  },
  "entries": [
    {
      "key": "ContractForm.Label3.Text",
      "sourceText": "Note: recipients and parameters must be filled in and Enable Email must be ticked",
      "translatedText": "Hinweis: Damit die Email richtig funktioniert muessen die Empfaenger und die Email Parameter vollstaendig ausgefuellt sein und Email aktivieren muss angekreuzt werden",
      "formName": "ContractForm",
      "componentName": "Label3",
      "componentClassName": "TLabel",
      "propertyName": "Text",
      "sourceFileName": "{FIXTUREDIR}\\\\37_a_panel_widens_so_its_note_keeps_one_line.fmx",
      "sourceLine": 23,
      "sourceKind": "Form property",
      "sourceChecksum": "",
      "contextKind": "interface text",
      "textOwnership": "designerAutomatic",
      "status": "machineTranslated"
    }
  ]
}
