{
  "schemaVersion": 3,
  "applicationId": "LayoutContract",
  "framework": "VCL",
  "sourceLanguage": "en-US",
  "locale": {"languageCode": "de-DE", "nativeLanguageName": "Deutsch", "textDirection": "ltr"},
  "entries": [
    {"key":"ContractForm.lblTo.Caption","sourceText":"To","translatedText":"Zu","formName":"ContractForm","componentName":"lblTo","componentClassName":"TLabel","propertyName":"Caption","sourceFileName":"{FIXTUREDIR}\\vcl_44_remaining_visual_polish.dfm","sourceKind":"Form property","contextKind":"interface text","textOwnership":"designerAutomatic","status":"machineTranslated"},
    {"key":"ContractForm.lblStart.Caption","sourceText":"Start","translatedText":"Start","formName":"ContractForm","componentName":"lblStart","componentClassName":"TLabel","propertyName":"Caption","sourceFileName":"{FIXTUREDIR}\\vcl_44_remaining_visual_polish.dfm","sourceKind":"Form property","contextKind":"interface text","textOwnership":"designerAutomatic","status":"machineTranslated"},
    {"key":"ContractForm.lblRecipient.Caption","sourceText":"Test Recipient Email Address:","translatedText":"E-Mail-Adresse des Testempfängers:","formName":"ContractForm","componentName":"lblRecipient","componentClassName":"TLabel","propertyName":"Caption","sourceFileName":"{FIXTUREDIR}\\vcl_44_remaining_visual_polish.dfm","sourceKind":"Form property","contextKind":"interface text","textOwnership":"designerAutomatic","status":"machineTranslated"},
    {"key":"ContractForm.lblVolume.Caption","sourceText":"System Volume:","translatedText":"Systemlautstärke:","formName":"ContractForm","componentName":"lblVolume","componentClassName":"TLabel","propertyName":"Caption","sourceFileName":"{FIXTUREDIR}\\vcl_44_remaining_visual_polish.dfm","sourceKind":"Form property","contextKind":"interface text","textOwnership":"designerAutomatic","status":"machineTranslated"},
    {"key":"ContractForm.btnMute.Caption","sourceText":"Mute","translatedText":"Stummschalten","formName":"ContractForm","componentName":"btnMute","componentClassName":"TButton","propertyName":"Caption","sourceFileName":"{FIXTUREDIR}\\vcl_44_remaining_visual_polish.dfm","sourceKind":"Form property","contextKind":"interface text","textOwnership":"designerAutomatic","status":"machineTranslated"},
    {"key":"ContractForm.btnSave.Caption","sourceText":"Save Settings","translatedText":"Einstellungen speichern","formName":"ContractForm","componentName":"btnSave","componentClassName":"TButton","propertyName":"Caption","sourceFileName":"{FIXTUREDIR}\\vcl_44_remaining_visual_polish.dfm","sourceKind":"Form property","contextKind":"interface text","textOwnership":"designerAutomatic","status":"machineTranslated"},
    {"key":"ContractForm.btnClose.Caption","sourceText":"Close","translatedText":"Schließen","formName":"ContractForm","componentName":"btnClose","componentClassName":"TButton","propertyName":"Caption","sourceFileName":"{FIXTUREDIR}\\vcl_44_remaining_visual_polish.dfm","sourceKind":"Form property","contextKind":"interface text","textOwnership":"designerAutomatic","status":"machineTranslated"},
    {"key":"ContractForm.btnRecalculate.Caption","sourceText":"Recalculate Easter and All Souls Dates","translatedText":"Ostern und Allerseelen neu berechnen","formName":"ContractForm","componentName":"btnRecalculate","componentClassName":"TButton","propertyName":"Caption","sourceFileName":"{FIXTUREDIR}\\vcl_44_remaining_visual_polish.dfm","sourceKind":"Form property","contextKind":"interface text","textOwnership":"designerAutomatic","status":"machineTranslated"},
    {"key":"ContractForm.btnReset.Caption","sourceText":"Reset Funeral Date Fields","translatedText":"Felder für das Begräbnisdatum zurücksetzen","formName":"ContractForm","componentName":"btnReset","componentClassName":"TButton","propertyName":"Caption","sourceFileName":"{FIXTUREDIR}\\vcl_44_remaining_visual_polish.dfm","sourceKind":"Form property","contextKind":"interface text","textOwnership":"designerAutomatic","status":"machineTranslated"},
    {"key":"ContractForm.lblInstructions.Caption","sourceText":"Click on the Select Random Directory button for any directory box, select a directory\r\nand add dates to put it into the rotation. Dates should be in the format of month/date\r\nonly (example: 04/27), with no year.","translatedText":"Klicken Sie in einem beliebigen Verzeichnisfeld auf die Schaltfläche Zufälliges Verzeichnis auswählen, wählen Sie ein Verzeichnis aus\r\nund fügen Sie Datumsangaben hinzu, um es in die Rotation aufzunehmen. Die Datumsangaben sollten ausschließlich im Format Monat/Tag\r\n(Beispiel: 27.04) ohne Jahresangabe angegeben werden.","formName":"ContractForm","componentName":"lblInstructions","componentClassName":"TLabel","propertyName":"Caption","sourceFileName":"{FIXTUREDIR}\\vcl_44_remaining_visual_polish.dfm","sourceKind":"Form property","contextKind":"interface text","textOwnership":"designerAutomatic","status":"machineTranslated"},
    {"key":"ContractForm.lblDefaultInstructions.Caption","sourceText":"The default directory must be set to have random music played. If not set, no random\r\nmusic will play. If the other directories are not usable, any random music play will fall\r\nback to the directory in this field.","translatedText":"Das Standardverzeichnis muss festgelegt werden, damit Musik nach dem Zufallsprinzip abgespielt wird. Ist es nicht festgelegt, wird keine Musik nach dem Zufallsprinzip\r\nabgespielt. Sind die anderen Verzeichnisse nicht nutzbar, greift die Wiedergabe nach dem Zufallsprinzip\r\nauf das in diesem Feld angegebene Verzeichnis zurück.","formName":"ContractForm","componentName":"lblDefaultInstructions","componentClassName":"TLabel","propertyName":"Caption","sourceFileName":"{FIXTUREDIR}\\vcl_44_remaining_visual_polish.dfm","sourceKind":"Form property","contextKind":"interface text","textOwnership":"designerAutomatic","status":"machineTranslated"}
  ]
}
