{
  "schemaVersion": 3,
  "applicationId": "LayoutContract",
  "applicationVersion": "",
  "framework": "FireMonkey",
  "sourceLanguage": "en-US",
  "locale": {
    "languageCode": "xx-XX",
    "nativeLanguageName": "Contract",
    "textDirection": "ltr",
    "shortDateFormat": "dd/mm/yyyy",
    "longDateFormat": "dddd, d mmmm yyyy",
    "shortTimeFormat": "h:nn",
    "longTimeFormat": "h:nn:ss",
    "decimalSeparator": ",",
    "thousandSeparator": ".",
    "currencySymbol": "$"
  },
  "entries": [
    {
      "key": "ContractForm.btnRecalc.Text",
      "sourceText": "Recalculate Dates for Upcoming Year",
      "translatedText": "Recalcular las fechas para el proximo ano.",
      "formName": "ContractForm",
      "componentName": "btnRecalc",
      "componentClassName": "TButton",
      "propertyName": "Text",
      "sourceFileName": "{FIXTUREDIR}\\21_caption_far_wider_than_its_box.fmx",
      "sourceLine": 16,
      "sourceKind": "Form property",
      "sourceChecksum": "",
      "contextKind": "interface text",
      "textOwnership": "designerAutomatic",
      "status": "machineTranslated"
    },
    {
      "key": "ContractForm.lblMedia.Text",
      "sourceText": "Media Player",
      "translatedText": "Reproductor multimedia",
      "formName": "ContractForm",
      "componentName": "lblMedia",
      "componentClassName": "TLabel",
      "propertyName": "Text",
      "sourceFileName": "{FIXTUREDIR}\\21_caption_far_wider_than_its_box.fmx",
      "sourceLine": 30,
      "sourceKind": "Form property",
      "sourceChecksum": "",
      "contextKind": "interface text",
      "textOwnership": "designerAutomatic",
      "status": "machineTranslated"
    }
  ]
}
