{
  "schemaVersion": 3,
  "applicationId": "LayoutContract",
  "applicationVersion": "",
  "framework": "FireMonkey",
  "sourceLanguage": "en-US",
  "locale": {
    "languageCode": "de-DE",
    "nativeLanguageName": "Deutsch",
    "textDirection": "ltr",
    "shortDateFormat": "dd.mm.yyyy",
    "longDateFormat": "dddd, d. mmmm yyyy",
    "shortTimeFormat": "h:nn",
    "longTimeFormat": "h:nn:ss",
    "decimalSeparator": ",",
    "thousandSeparator": ".",
    "currencySymbol": "EUR"
  },
  "entries": [
    {
      "key": "ContractForm.btnSave.Caption",
      "sourceText": "Save",
      "translatedText": "Einstellungen speichern",
      "formName": "ContractForm",
      "componentName": "btnSave",
      "componentClassName": "TButton",
      "propertyName": "Caption",
      "sourceFileName": "{FIXTUREDIR}\\\\38_a_button_pair_shares_one_text_size.fmx",
      "sourceKind": "Form property",
      "contextKind": "interface text",
      "textOwnership": "designerAutomatic",
      "status": "machineTranslated"
    },
    {
      "key": "ContractForm.btnClose.Caption",
      "sourceText": "Close",
      "translatedText": "Schließen",
      "formName": "ContractForm",
      "componentName": "btnClose",
      "componentClassName": "TButton",
      "propertyName": "Caption",
      "sourceFileName": "{FIXTUREDIR}\\\\38_a_button_pair_shares_one_text_size.fmx",
      "sourceKind": "Form property",
      "contextKind": "interface text",
      "textOwnership": "designerAutomatic",
      "status": "machineTranslated"
    }
  ]
}
